<?xml version="1.0" encoding="UTF-8"?>
<pdf xmlns="http://www.idawn.org" xmlns:xsi="http://www.w3.org/2001/XMLSchema-instance" xsi:schemaLocation="http://www.idawn.org pdf.xsd">
	<styles>
		<style id="title" textalignment="CENTER" fontsize="16" bold="true" />
		<style id="table" fontsize="8" />
		<style id="bold" bold="true" />
		<style id="margin-top-bottom" margin-top="36" margin-bottom="36" />
		<style id="margin-bottom" margin-bottom="36" />
		<style id="margin-top" margin-top="36" />
		<style id="firstLineIndent"  />
		<style id="sign-box"  margin-top="20" textalignment="RIGHT"/>
		<style id="no_border" border="0"/>
		<style id="ce-box"  textalignment="CENTER"/>
	</styles>
	
	<body pagesize="A4" fontsize="10" margin-top="36" margin-right="45" margin-bottom="36" margin-left="45">
		<page>
			<title value="还款管理服务说明书" style="title" />
			<p fill="true"><span>#{custName}先生/女士，您好!</span></p>
			<p><span></span></p>
			<p first-line-indent="14"><span>1. 还款账户：在《授权扣款委托书》里列示的银行账户是您每次用于还款的账户，请您妥善保管好该银行卡。如发生此银行卡丢失、损坏的情况，请您第一时间联系红上至信商务信息咨询（上海）有限公司（下称“红上公司”），我们将根据具体情况，协助您安排按时还款事宜，以避免不必要的逾期违约金和罚息的产生。如您需变更还款账户，请及时向红上公司提出申请，红上公司相关的工作人员将协助您办理变更还款账户的相关事项。</span></p>
			<p><span></span></p>
			<p first-line-indent="14"><span>2.还款账户最低余额为15元：为了保证您的还款成功扣划，请确保您的还款账户余额在划扣当月还款额后，仍不少于15元。此金额有可能用于支付还款银行的“年费”和其他相关费用。关于此“年费”和其他费用收费标准，请致电您的还款账户开户银行咨询。</span></p>
			<p><span></span></p>
			<p first-line-indent="14" fill="true"><span>3.还款金额：您的每月还款额为RMB #{payMonth}元,请您务必牢记此数字。</span></p>
			<p><span></span></p>
			<p first-line-indent="14" fill="true"><span>4.还款时间：请您在每月#{payDate}日16点之前，将每月还款数额足额存到您的借记卡里，逾期将产生不必要的罚息和违约金，并会影响您的个人信用记录。请您务必记牢还款日，此还款日不因节假日顺延；若当月没有该日期，则还款日为当月最后一天。若您采用跨行转账方式汇入还款账户，请提前一周进行划转。红上公司将以成功划扣还款账户的还款金额时间为准，记录还款时间。如果您申请提前还款或者根据约定您被要求提前还款，则您的还款日期和还款金额按照约定条款确定。</span></p>
			<p><span></span></p>
			<p first-line-indent="14"><span>5.重要提示：红上公司将在第4条规定的还款日期9点至16点之间进行多次划扣，期间划扣成功视为按时还款；至还款日16点后仍扣款失败则视为您还款逾期。</span></p>
			<p><span></span></p>
			<p first-line-indent="14"><span>6.如您因特殊原因暂时无法按时足额还款时，请在当月还款日期之前与红上公司联系。红上公司将协助您安排预约还款并准确告知您还款金额（本息、逾期违约金、罚息、协议约定的相关费用等）。特别需要您注意的是：红上公司有权（代表自身或特定出借人的利益）根据有关协议要求您支付剩余全部借款金额、利息、垫付服务费用、逾期违约金等相关费用。</span></p>
			<p><span></span></p>
			<p first-line-indent="14"><span>7.以下列举如果您在还款第一期即出现不能按时还款且红上公司垫付的情况下，以违约1天和16天为例，您应当支付的垫付服务费用和逾期违约金金额：</span></p>
			<p><span></span></p>
			<table column="3" style="ce-box">
				<th clm="1" row="1">违约天数</th>
				<th clm="1" row="1">垫付服务费用（人民币元）</th>
				<th clm="1" row="1">逾期违约金（人民币元）</th>
				<th clm="1" row="1">1天 </th>
				<th clm="1" row="1"  fill="true">￥#{fOneMoney}</th>
				<th clm="1" row="1"  fill="true">￥#{oveOneMoney}</th>
				<th clm="1" row="1">16天</th>
				<th clm="1" row="1"  fill="true">￥#{fSixteenMoney}</th>
				<th clm="1" row="1"  fill="true">￥#{oveOneMoney}</th>
			</table>
			<p><span></span></p>
			<p first-line-indent="14"><span>8.联系方式变更：为了方便我们更好的服务于您，如果您或是您担保人的联系方式、工作单位、居住或工作地址发生变化，请在第一时间通知红上公司（联系电话：400—602—7111 ）。</span></p>
			<p><span></span></p>
			<p  first-line-indent="14"><span>9.您在红上公司积累了一定的良好信用记录后，比如您已经按时还满一定期数的款项后，如果您有新的借款需求，红上公司会根据您的信用级别、还款情况和还款额提供追加贷的帮助。咨询电话400—602—7111。</span></p>
			<p><span></span></p>
			<p  first-line-indent="14"><span>10.提前一次性还款：为了方便红上公司更好的服务于您，如果您决定于某一还款日提前一次性将全部款项结清，请您务必至少在该还款日前三个营业日前与红上公司相关部门进行沟通，红上公司将帮助您安排预约一次性还款的相关事宜。若因为您提出提前还款的申请时间不满足上述要求，红上公司可能无法为您完成当月提前还款的相关操作，因此带来的利息等损失须由您自身承担。如果发生您应当提前一次性还款的情形，请您在对应的还款日期按照本说明第4条规定进行操作。</span></p>
			<p><span></span></p>
			<p  first-line-indent="14"><span>11.若您有任何问题或金融服务的需求，均可致电红上公司以便获得专业的信用咨询和帮助:咨询电话:400—602—7111。</span></p>
			<p><span></span></p>
			<p  first-line-indent="14"><span>您的还款分期表如下（以下日期为红上公司代为扣款的日期，最终还款日期根据借款协议确定，中间因还款管理操作原因可能存在时间差，您已确认对该等时间差予以接受并同意）：</span></p>
		</page>
		<page>
			<table column="5" foreach="true" var="#{repaymentPlans}" item="plan">
				<th clm="1" row="1">期数</th>
				<th clm="1" row="1">计划还款日</th>
				<th clm="1" row="1">月还款额</th>
				<th clm="1" row="1">尚欠本金</th>
				<th clm="1" row="1">当期一次性还款金额</th>
				<td clm="1" row="1" fill="true">#{plan.shouldTerm}</td>
				<td clm="1" row="1" fill="true">#{plan.shouldDate}</td>
				<td clm="1" row="1" fill="true">#{plan.shouldAmt}</td>
				<td clm="1" row="1" fill="true">#{plan.bal}</td>
				<td clm="1" row="1" fill="true">#{plan.advanceMoney}</td>
			</table>
			<p><span></span></p>
			<p  first-line-indent="14"><span>以上内容由红上公司进行讲解，对于上述内容我已没有疑问。</span></p>
			<p><span></span></p>
			<p><span></span></p>
			<p><span></span></p>
			<table column="1" style="sign-box">
				<th clm="1" row="1" border="0">借款人签字：_________________</th>
				<th clm="1" row="1" border="0">讲解人签字：_________________</th>
				<th clm="1" row="1" border="0">签订日期：______年____月____日</th>
			</table>
		</page>

	</body>
</pdf>